Codec: Cirrus Logic CS4206
Address: 0
AFG Function Id: 0x1 (unsol 0)
Vendor Id: 0x10134206
Subsystem Id: 0x106b4d00
Revision Id: 0x100301
No Modem Function Group found
Default PCM:
    rates [0x7f0]: 32000 44100 48000 88200 96000 176400 192000
    bits [0x1e]: 16 20 24 32
    formats [0x3]: PCM FLOAT
Default Amp-In caps: N/A
Default Amp-Out caps: N/A
State of AFG node 0x01:
  Power states:  D0 D3 CLKSTOP EPSS
  Power: setting=D0, actual=D0
GPIO: io=4, o=0, i=0, unsolicited=0, wake=0
  IO[0]: enable=0, dir=0, wake=0, sticky=0, data=0, unsol=0
  IO[1]: enable=1, dir=1, wake=0, sticky=0, data=0, unsol=0
  IO[2]: enable=0, dir=0, wake=0, sticky=0, data=0, unsol=0
  IO[3]: enable=1, dir=1, wake=0, sticky=0, data=1, unsol=0
Node 0x02 [Audio Output] wcaps 0xd041d: Stereo Amp-Out
  Control: name="Headphone Playback Volume", index=0, device=0
    ControlAmp: chs=3, dir=Out, idx=0, ofs=0
  Control: name="Headphone Playback Switch", index=0, device=0
    ControlAmp: chs=3, dir=Out, idx=0, ofs=0
  Amp-Out caps: ofs=0x73, nsteps=0x7f, stepsize=0x01, mute=1
  Amp-Out vals:  [0x80 0x80]
  Converter: stream=0, channel=0
  PCM:
    rates [0x7f0]: 32000 44100 48000 88200 96000 176400 192000
    bits [0x1e]: 16 20 24 32
    formats [0x3]: PCM FLOAT
  Power states:  D0 D3 EPSS
  Power: setting=D3, actual=D3
  Delay: 13 samples
Node 0x03 [Audio Output] wcaps 0xd041d: Stereo Amp-Out
  Control: name="Bass Speaker Playback Volume", index=0, device=0
    ControlAmp: chs=3, dir=Out, idx=0, ofs=0
  Control: name="Bass Speaker Playback Switch", index=0, device=0
    ControlAmp: chs=3, dir=Out, idx=0, ofs=0
  Amp-Out caps: ofs=0x73, nsteps=0x7f, stepsize=0x01, mute=1
  Amp-Out vals:  [0x4b 0x4b]
  Converter: stream=0, channel=0
  PCM:
    rates [0x7f0]: 32000 44100 48000 88200 96000 176400 192000
    bits [0x1e]: 16 20 24 32
    formats [0x3]: PCM FLOAT
  Power states:  D0 D3 EPSS
  Power: setting=D3, actual=D3
  Delay: 13 samples
Node 0x04 [Audio Output] wcaps 0xd041d: Stereo Amp-Out
  Control: name="Speaker Playback Volume", index=0, device=0
    ControlAmp: chs=3, dir=Out, idx=0, ofs=0
  Control: name="Speaker Playback Switch", index=0, device=0
    ControlAmp: chs=3, dir=Out, idx=0, ofs=0
  Device: name="CS4206 Analog", type="Audio", device=0
  Amp-Out caps: ofs=0x73, nsteps=0x7f, stepsize=0x01, mute=1
  Amp-Out vals:  [0x4b 0x4b]
  Converter: stream=0, channel=0
  PCM:
    rates [0x7f0]: 32000 44100 48000 88200 96000 176400 192000
    bits [0x1e]: 16 20 24 32
    formats [0x3]: PCM FLOAT
  Power states:  D0 D3 EPSS
  Power: setting=D3, actual=D3
  Delay: 13 samples
Node 0x05 [Audio Input] wcaps 0x18051b: Stereo Amp-In
  Amp-In caps: ofs=0x33, nsteps=0x3f, stepsize=0x03, mute=1
  Amp-In vals:  [0xb3 0xb3]
  Converter: stream=0, channel=0
  SDI-Select: 0
  PCM:
    rates [0x1f5]: 8000 16000 32000 44100 48000 88200 96000
    bits [0x1e]: 16 20 24 32
    formats [0x3]: PCM FLOAT
  Power states:  D0 D3 EPSS
  Power: setting=D3, actual=D0
  Delay: 8 samples
  Connection: 2
     0x0c* 0x12
Node 0x06 [Audio Input] wcaps 0x18051b: Stereo Amp-In
  Control: name="Capture Volume", index=0, device=0
    ControlAmp: chs=3, dir=In, idx=0, ofs=0
  Control: name="Capture Switch", index=0, device=0
    ControlAmp: chs=3, dir=In, idx=0, ofs=0
  Device: name="CS4206 Analog", type="Audio", device=0
  Amp-In caps: ofs=0x33, nsteps=0x3f, stepsize=0x03, mute=1
  Amp-In vals:  [0x3f 0x3f]
  Converter: stream=0, channel=0
  SDI-Select: 0
  PCM:
    rates [0x1f5]: 8000 16000 32000 44100 48000 88200 96000
    bits [0x1e]: 16 20 24 32
    formats [0x3]: PCM FLOAT
  Power states:  D0 D3 EPSS
  Power: setting=D3, actual=D0
  Delay: 8 samples
  Connection: 2
     0x0d* 0x0e
Node 0x07 [Audio Input] wcaps 0x180791: Stereo Digital
  Converter: stream=0, channel=0
  SDI-Select: 0
  Digital: Preemphasis Non-Copyright
  Digital category: 0x0
  IEC Coding Type: 0x0
  PCM:
    rates [0x570]: 32000 44100 48000 96000 192000
    bits [0x1e]: 16 20 24 32
    formats [0x7]: PCM FLOAT AC3
  Unsolicited: tag=00, enabled=0
  Power states:  D0 D3 EPSS
  Power: setting=D0, actual=D0
  Delay: 8 samples
  Connection: 1
     0x0f
Node 0x08 [Audio Output] wcaps 0x40611: Stereo Digital
  Control: name="IEC958 Playback Con Mask", index=0, device=0
  Control: name="IEC958 Playback Pro Mask", index=0, device=0
  Control: name="IEC958 Playback Default", index=0, device=0
  Control: name="IEC958 Playback Switch", index=0, device=0
  Control: name="IEC958 Default PCM Playback Switch", index=0, device=0
  Device: name="CS4206 Digital", type="SPDIF", device=1
  Converter: stream=0, channel=0
  Digital:
  Digital category: 0x0
  IEC Coding Type: 0x0
  PCM:
    rates [0x7f0]: 32000 44100 48000 88200 96000 176400 192000
    bits [0x1e]: 16 20 24 32
    formats [0x7]: PCM FLOAT AC3
  Power states:  D0 D3 EPSS
  Power: setting=D3, actual=D3
  Delay: 4 samples
Node 0x09 [Pin Complex] wcaps 0x410581: Stereo
  Pincap 0x0000001c: OUT HP Detect
  Pin Default 0x0e2b4030: [Jack] HP Out at Ext UNKNOWN
    Conn = Comb, Color = Green
    DefAssociation = 0x3, Sequence = 0x0
  Pin-ctls: 0xc0: OUT HP
  Unsolicited: tag=01, enabled=1
  Power states:  D0 D3 EPSS
  Power: setting=D3, actual=D3
  Delay: 1 samples
  Connection: 1
     0x02
Node 0x0a [Pin Complex] wcaps 0x410581: Stereo
  Pincap 0x00000054: OUT Detect Balanced
  Pin Default 0x90100121: [Fixed] Speaker at Int N/A
    Conn = Unknown, Color = Unknown
    DefAssociation = 0x2, Sequence = 0x1
    Misc = NO_PRESENCE
  Pin-ctls: 0x40: OUT
  Unsolicited: tag=00, enabled=0
  Power states:  D0 D3 EPSS
  Power: setting=D3, actual=D3
  Delay: 1 samples
  Connection: 1
     0x03
Node 0x0b [Pin Complex] wcaps 0x410101: Stereo
  Pincap 0x00000050: OUT Balanced
  Pin Default 0x90100120: [Fixed] Speaker at Int N/A
    Conn = Unknown, Color = Unknown
    DefAssociation = 0x2, Sequence = 0x0
    Misc = NO_PRESENCE
  Pin-ctls: 0x40: OUT
  Delay: 1 samples
  Connection: 1
     0x04
Node 0x0c [Pin Complex] wcaps 0x41048b: Stereo Amp-In
  Amp-In caps: ofs=0x00, nsteps=0x03, stepsize=0x27, mute=0
  Amp-In vals:  [0x00 0x00]
  Pincap 0x00000024: IN Detect
  Pin Default 0x0f8b3050: [Jack] Line In at Ext UNKNOWN
    Conn = Comb, Color = Blue
    DefAssociation = 0x5, Sequence = 0x0
  Pin-ctls: 0x00:
  Unsolicited: tag=00, enabled=0
  Power states:  D0 D3 EPSS
  Power: setting=D3, actual=D0
  Delay: 1 samples
Node 0x0d [Pin Complex] wcaps 0x41048b: Stereo Amp-In
  Control: name="Mic Boost Volume", index=0, device=0
    ControlAmp: chs=3, dir=In, idx=0, ofs=0
  Amp-In caps: ofs=0x00, nsteps=0x03, stepsize=0x27, mute=0
  Amp-In vals:  [0x00 0x00]
  Pincap 0x00001764: IN Detect Balanced
    Vref caps: HIZ 50 GRD 80
  Pin Default 0x90a00110: [Fixed] Mic at Int N/A
    Conn = Unknown, Color = Unknown
    DefAssociation = 0x1, Sequence = 0x0
    Misc = NO_PRESENCE
  Pin-ctls: 0x24: IN VREF_80
  Unsolicited: tag=00, enabled=0
  Power states:  D0 D3 EPSS
  Power: setting=D3, actual=D0
  Delay: 1 samples
Node 0x0e [Pin Complex] wcaps 0x41000b: Stereo Amp-In
  Amp-In caps: ofs=0x00, nsteps=0x02, stepsize=0x27, mute=0
  Amp-In vals:  [0x00 0x00]
  Pincap 0x00000020: IN
  Pin Default 0x400000f0: [N/A] Line Out at Ext N/A
    Conn = Unknown, Color = Unknown
    DefAssociation = 0xf, Sequence = 0x0
  Pin-ctls: 0x00:
  Delay: 1 samples
Node 0x0f [Pin Complex] wcaps 0x410681: Stereo Digital
  Pincap 0x00000024: IN Detect
  Pin Default 0x400000f0: [N/A] Line Out at Ext N/A
    Conn = Unknown, Color = Unknown
    DefAssociation = 0xf, Sequence = 0x0
  Pin-ctls: 0x00:
  Unsolicited: tag=00, enabled=0
  Power states:  D0 D3 EPSS
  Power: setting=D3, actual=D3
  Delay: 1 samples
Node 0x10 [Pin Complex] wcaps 0x410301: Stereo Digital
  Pincap 0x00000010: OUT
  Pin Default 0x014be040: [Jack] SPDIF Out at Ext Rear
    Conn = Comb, Color = White
    DefAssociation = 0x4, Sequence = 0x0
  Pin-ctls: 0x40: OUT
  Delay: 1 samples
  Connection: 1
     0x08
Node 0x11 [Vendor Defined Widget] wcaps 0xf00040: Mono
  Processing caps: benign=0, ncoeff=22
Node 0x12 [Pin Complex] wcaps 0x41000b: Stereo Amp-In
  Amp-In caps: ofs=0x00, nsteps=0x02, stepsize=0x27, mute=0
  Amp-In vals:  [0x00 0x00]
  Pincap 0x00000020: IN
  Pin Default 0x400000f0: [N/A] Line Out at Ext N/A
    Conn = Unknown, Color = Unknown
    DefAssociation = 0xf, Sequence = 0x0
  Pin-ctls: 0x00:
  Delay: 1 samples
Node 0x13 [Beep Generator Widget] wcaps 0x700000: Mono
Node 0x14 [Audio Output] wcaps 0x40611: Stereo Digital
  Converter: stream=0, channel=0
  Digital:
  Digital category: 0x0
  IEC Coding Type: 0x0
  PCM:
    rates [0x7f0]: 32000 44100 48000 88200 96000 176400 192000
    bits [0x1e]: 16 20 24 32
    formats [0x7]: PCM FLOAT AC3
  Power states:  D0 D3 EPSS
  Power: setting=D3, actual=D3
  Delay: 4 samples
Node 0x15 [Pin Complex] wcaps 0x410301: Stereo Digital
  Pincap 0x00000010: OUT
  Pin Default 0x400000f0: [N/A] Line Out at Ext N/A
    Conn = Unknown, Color = Unknown
    DefAssociation = 0xf, Sequence = 0x0
  Pin-ctls: 0x00:
  Delay: 1 samples
  Connection: 1
     0x14
